[
   {
     "name": "My Product",
     "brand": "My Brand",
     "store": "My Store",
     "producer": "My Producer",
     "labels": [
       "BEPI",
       "BSCI"
     ],
     "ingredients": [
       "Milk",
       {
         "name": "Cacoa butter",
         "resource": "Cacoa"
       }
     ]
   },
   {
     "name": "Another Product",
     "brand": "My second Brand",
     "store": "My Store",
     "producer": "My Producer",
     "labels": [
       "Fair Trade"
     ],
     "ingredients": [
       {
         "name": "Silk",
         "resource": "Silk"
       }
     ]
   }
]
